{
  "id": "skill.flame.scorch.v1",
  "intent": "flame",
  "nameKey": "skill.flame.scorch.v1.name",
  "kind": "bolt",
  "manaCost": 18,
  "skillMultiplier": 1.2,
  "cooldownMs": 3000,
  "effects": [
    {
      "type": "projectile",
      "damage": {
        "skillMultiplier": 1.2,
        "damageType": "spirit"
      },
      "speed": 420,
      "rangePx": 400,
      "hitRadius": 12
    }
  ]
}
