{
  "id": "skill.time.loop.v3",
  "intent": "time",
  "nameKey": "skill.time.loop.v3.name",
  "kind": "bolt",
  "manaCost": 22,
  "skillMultiplier": 1,
  "cooldownMs": 5500,
  "effects": [
    {
      "type": "projectile",
      "damage": {
        "skillMultiplier": 1,
        "damageType": "spirit"
      },
      "speed": 420,
      "rangePx": 400,
      "hitRadius": 12
    }
  ],
  "vfx": {
    "cast": "vfx_time_cast"
  }
}
