{
  "id": "skill.void.rift.v1",
  "intent": "void",
  "nameKey": "skill.void.rift.v1.name",
  "kind": "bolt",
  "manaCost": 18,
  "skillMultiplier": 1.3,
  "cooldownMs": 2800,
  "effects": [
    {
      "type": "projectile",
      "damage": {
        "skillMultiplier": 1.3,
        "damageType": "spirit"
      },
      "speed": 420,
      "rangePx": 400,
      "hitRadius": 12
    }
  ],
  "vfx": {
    "cast": "vfx_void_cast"
  }
}
